{
  "schemaVersion": 1,
  "id": "SL-07",
  "method": "Забытый аккаунт",
  "summary": "Вход через старую тестовую или сервисную учётку.",
  "realTerm": "Забытые тестовые и сервисные учётные записи (orphaned / stale accounts).",
  "whyItWorks": "При настройке систем заводят временные, тестовые и сервисные учётки со слабыми или стандартными паролями. После запуска о них забывают, а права у них часто высокие.",
  "defense": "Регулярный аудит учётных записей, удаление неиспользуемых, управление секретами и минимально необходимые права для сервисных аккаунтов.",
  "realCase": "Во многих расследованных взломах точкой закрепления становилась давно забытая сервисная или тестовая учётка, про которую никто не помнил.",
  "law": "Проверять такую слабость законно только по договору на пентест, с письменного разрешения владельца системы. Без него это преступление: статьи 272-274 УК РФ.",
  "learnMore": [
    {
      "title": "MITRE ATT&CK — Valid Accounts",
      "url": "https://attack.mitre.org/"
    },
    {
      "title": "TryHackMe — учебные комнаты",
      "url": "https://tryhackme.com/"
    }
  ]
}
