{
  "schemaVersion": 1,
  "id": "SL-06",
  "method": "Горизонтальное перемещение",
  "summary": "Прыжок на соседний узел по доверенной связи.",
  "realTerm": "Горизонтальное перемещение через доверенные связи (lateral movement).",
  "whyItWorks": "Внутри сети узлы доверяют друг другу. Закрепившись на одном, атакующий переходит к следующему по уже существующим доверенным связям, не вскрывая каждый заново.",
  "defense": "Сегментация сети, модель нулевого доверия (zero trust) и права по принципу минимально необходимого, чтобы один захваченный узел не открывал всю сеть.",
  "realCase": "В большинстве крупных взломов первый доступ был лишь точкой входа: основной ущерб наносило последующее продвижение вглубь сети.",
  "law": "Проверять такую слабость законно только по договору на пентест, с письменного разрешения владельца системы. Без него это преступление: статьи 272-274 УК РФ.",
  "learnMore": [
    {
      "title": "MITRE ATT&CK — Lateral Movement",
      "url": "https://attack.mitre.org/"
    },
    {
      "title": "TryHackMe — учебные комнаты",
      "url": "https://tryhackme.com/"
    }
  ]
}
