{
  "schemaVersion": 1,
  "id": "SL-04",
  "method": "Эксплойт уязвимости",
  "summary": "Пробой через известную дыру в непропатченном софте.",
  "realTerm": "Непропатченный софт и известные уязвимости (CVE).",
  "whyItWorks": "Когда уязвимость публикуют, исправление выходит вместе с её описанием. Тот, кто не обновился, остаётся с дырой, о которой уже знают все.",
  "defense": "Патч-менеджмент с понятными сроками, инвентаризация всего софта, подписка на бюллетени безопасности и компенсирующие меры, пока обновление нельзя поставить.",
  "realCase": "В 2017 году Equifax взломали через уязвимость в веб-фреймворке Apache Struts, исправление для которой вышло за два месяца до атаки. Утекли данные около 147 миллионов человек.",
  "law": "Проверять такую слабость законно только по договору на пентест, с письменного разрешения владельца системы. Без него это преступление: статьи 272-274 УК РФ.",
  "learnMore": [
    {
      "title": "NVD — база известных уязвимостей",
      "url": "https://nvd.nist.gov/"
    },
    {
      "title": "OWASP Top 10",
      "url": "https://owasp.org/Top10/"
    }
  ]
}
