{
  "schemaVersion": 1,
  "id": "SL-02",
  "method": "Брутфорс",
  "summary": "Подбор пароля перебором и по чужим утечкам.",
  "realTerm": "Слабые и переиспользованные пароли; password spraying и credential stuffing.",
  "whyItWorks": "Люди выбирают пароли из имён, дат и простых слов и повторяют один пароль на многих сервисах. Пароль, утёкший с одного сайта, открывает доступ к другим.",
  "defense": "Уникальный длинный пароль на каждый сервис, менеджер паролей, многофакторная аутентификация, проверка паролей по базам утечек и ограничение числа попыток входа.",
  "realCase": "В 2012 году в рабочий аккаунт сотрудника Dropbox вошли с паролем, утёкшим с другого сайта, и получили список адресов пользователей.",
  "law": "Проверять такую слабость законно только по договору на пентест, с письменного разрешения владельца системы. Без него это преступление: статьи 272-274 УК РФ.",
  "learnMore": [
    {
      "title": "Have I Been Pwned",
      "url": "https://haveibeenpwned.com/"
    },
    {
      "title": "OWASP Top 10",
      "url": "https://owasp.org/Top10/"
    }
  ]
}
