{
  "schemaVersion": 1,
  "id": "SL-08",
  "method": "Пробой сегментации",
  "summary": "Проход сквозь плоскую сеть и дыры в фаерволе.",
  "realTerm": "Слабая сегментация сети и ошибки правил межсетевого экрана (flat network, firewall misconfig).",
  "whyItWorks": "Если сеть «плоская» или в правилах файрвола есть щель, то один захваченный узел открывает доступ ко всей сети — внутренние сервисы ничем не отделены друг от друга.",
  "defense": "Сегментация сети на зоны, регулярный аудит правил межсетевого экрана и модель нулевого доверия между сегментами.",
  "realCase": "В «плоских» корпоративных сетях одна проникшая машина не раз давала атакующему путь ко всей инфраструктуре сразу.",
  "law": "Проверять такую слабость законно только по договору на пентест, с письменного разрешения владельца системы. Без него это преступление: статьи 272-274 УК РФ.",
  "learnMore": [
    {
      "title": "MITRE ATT&CK",
      "url": "https://attack.mitre.org/"
    },
    {
      "title": "TryHackMe — учебные комнаты",
      "url": "https://tryhackme.com/"
    }
  ]
}
